ID,bridge_ID,orderNumber,inspectionType,status,plannedDate,startedAt,completedAt,inspector,inspectorOrg,accessMethod,ratingMethod,overallConditionRating,structuralAdequacy,maintenanceUrgency,scourAssessment,recommendations,reportRef,nextInspectionDue,notes
50000000-0000-0000-0000-000000000001,30000000-0000-0000-0000-000000000001,INS-2024-001,ROUTINE,COMPLETED,2024-03-10,2024-03-15T08:00:00Z,2024-03-15T17:00:00Z,J. Thompson,Aurecon Group,WALK,VISUAL,8,ADEQUATE,LONG_TERM,No scour issues detected. Bed level stable.,Routine maintenance of deck joints recommended within 12 months.,REP-2024-001,2026-03-15,Annual routine inspection. Structure in good order.
50000000-0000-0000-0000-000000000002,30000000-0000-0000-0000-000000000002,INS-2024-002,ROUTINE,COMPLETED,2024-01-15,2024-01-20T08:30:00Z,2024-01-20T16:30:00Z,M. Chen,GHD Engineering,UNDER_BRIDGE,VISUAL,6,MARGINAL,MEDIUM_TERM,Evidence of scour in 2 of 5 piers. Scour depth estimated 0.3m below design level.,Scour protection required at Piers 2 and 4. Underwater inspection recommended within 6 months. Mass restriction maintained.,REP-2024-002,2025-01-20,Condition declining. Scour risk elevated after 2023 flooding.
50000000-0000-0000-0000-000000000003,30000000-0000-0000-0000-000000000003,INS-2023-003,SPECIAL,COMPLETED,2023-11-05,2023-11-10T07:00:00Z,2023-11-10T18:00:00Z,R. Patel,WSP Australia,LANE_CLOSURE,NDE,4,MARGINAL,SHORT_TERM,Critical scour observed at 2 piers. Undermining of pile cap detected.,Immediate load restriction review required. Scour remediation works within 3 months. Principal inspection recommended.,REP-2023-003,2024-05-10,Special inspection triggered by flood event. Multiple defects identified.
50000000-0000-0000-0000-000000000004,30000000-0000-0000-0000-000000000004,INS-2024-004,ROUTINE,COMPLETED,2024-04-28,2024-05-01T08:00:00Z,2024-05-01T16:00:00Z,S. Wilson,Jacobs Group,WALK,VISUAL,9,ADEQUATE,LONG_TERM,No scour detected. Rock foundation stable.,No significant maintenance required. Continue routine monitoring.,REP-2024-004,2026-05-01,Excellent condition. Pacific Highway upgrade structure performing well.
50000000-0000-0000-0000-000000000005,30000000-0000-0000-0000-000000000005,INS-2024-005,ROUTINE,COMPLETED,2024-02-10,2024-02-12T09:00:00Z,2024-02-12T15:00:00Z,L. Nguyen,AECOM Australia,WALK,VISUAL,7,ADEQUATE,MEDIUM_TERM,Minor localised scour at upstream pier. Monitoring advised.,Concrete repair to pier 1 recommended. Next inspection in 2 years.,REP-2024-005,2026-02-12,Fair condition overall. Some concrete deterioration noted.
50000000-0000-0000-0000-000000000006,30000000-0000-0000-0000-000000000003,INS-2024-006,PRINCIPAL,PLANNED,2024-06-01,,,Dr A. Martinez,University of Melbourne,SCAFFOLD,ANALYTICAL,,,,,Principal inspection scheduled following 2023 defect findings.,,2025-06-01,
50000000-0000-0000-0000-000000000007,30000000-0000-0000-0000-000000000007,INS-2024-007,UNDERWATER,IN_PROGRESS,2024-04-20,2024-04-22T07:00:00Z,,T. Brown,Marine Engineering Services,BOAT,NDE,,,,,Underwater inspection of pier foundations in progress.,,,Triggered by CRITICAL scour risk assessment.
